{
  "schema_version": "antipatterns.v1",
  "catalog_version": "1.0.0",
  "description": "Anti-pattern catalog read by rig and the Reviewer. Each rule maps one detector rule to a stable AP-* ID. Every rule is advisory; none blocks. Mapping status says whether the detector rule was run (verified), taken from documentation (mapped), or does not exist yet (planned).",
  "standard": "00_UniversalStandards/11_Anti_Pattern_Catalog.md",
  "promotion": {
    "min_true_positives": 20,
    "min_clean_cases": 50,
    "min_precision_lower_bound": 0.9,
    "confidence_level": 0.95,
    "max_age_days": 90
  },
  "rules": [
    {
      "id": "AP-GO-001",
      "revision": 1,
      "added_in": "1.0.0",
      "stack": "go",
      "framework": "none",
      "title": "Context cancel function discarded",
      "description": "The cancel function returned by context.WithCancel/WithTimeout/WithDeadline is dropped or never called.",
      "rationale": "The context's timer and goroutines live until the parent is cancelled: a leak per call on a hot path.",
      "severity": "high",
      "confidence": "high",
      "detector": {
        "tool": "go-vet",
        "rule_id": "lostcancel",
        "custom": false,
        "mapping": {
          "status": "verified",
          "tool_version": "go version go1.26.10 linux/amd64",
          "verified_on": "2026-10-22",
          "verified_in": "local",
          "toolchain": "playbook-antipattern-toolchain@sha256:4ae0d1b7618684cf7d92adfdffe8afd2301e96edb25488ce90d67dee80558d4d"
        }
      },
      "remediation": "Call defer cancel() immediately after creating the context.",
      "references": [
        "https://pkg.go.dev/golang.org/x/tools/go/analysis/passes/lostcancel"
      ],
      "test_cases": {
        "positive": [
          {
            "file": "main.go",
            "code": "package main\n\nimport (\n\t\"context\"\n\t\"time\"\n)\n\nfunc work(ctx context.Context) {}\n\nfunc main() {\n\tctx, _ := context.WithTimeout(context.Background(), time.Second)\n\twork(ctx)\n}\n"
          }
        ],
        "negative": [
          {
            "file": "main.go",
            "code": "package main\n\nimport (\n\t\"context\"\n\t\"time\"\n)\n\nfunc work(ctx context.Context) {}\n\nfunc main() {\n\tctx, cancel := context.WithTimeout(context.Background(), time.Second)\n\tdefer cancel()\n\twork(ctx)\n}\n"
          }
        ]
      },
      "enforcement": {
        "state": "advisory",
        "blocks": false
      },
      "benchmark": {
        "status": "unmeasured"
      },
      "related": [
        "ARCH-017"
      ]
    },
    {
      "id": "AP-GO-002",
      "revision": 1,
      "added_in": "1.0.0",
      "stack": "go",
      "framework": "none",
      "title": "Lock copied by value",
      "description": "A value containing a sync.Mutex (or other lock) is passed or assigned by value.",
      "rationale": "The copy has its own lock state, so the code that looks synchronized is not.",
      "severity": "high",
      "confidence": "high",
      "detector": {
        "tool": "go-vet",
        "rule_id": "copylocks",
        "custom": false,
        "mapping": {
          "status": "verified",
          "tool_version": "go version go1.26.10 linux/amd64",
          "verified_on": "2026-10-22",
          "verified_in": "local",
          "toolchain": "playbook-antipattern-toolchain@sha256:4ae0d1b7618684cf7d92adfdffe8afd2301e96edb25488ce90d67dee80558d4d"
        }
      },
      "remediation": "Pass a pointer to the struct, or keep the lock behind a pointer.",
      "references": [
        "https://pkg.go.dev/golang.org/x/tools/go/analysis/passes/copylocks"
      ],
      "test_cases": {
        "positive": [
          {
            "file": "main.go",
            "code": "package main\n\nimport \"sync\"\n\ntype Counter struct {\n\tmu sync.Mutex\n\tn  int\n}\n\nfunc read(c Counter) int { return c.n }\n\nfunc main() {\n\tvar c Counter\n\t_ = read(c)\n}\n"
          }
        ],
        "negative": [
          {
            "file": "main.go",
            "code": "package main\n\nimport \"sync\"\n\ntype Counter struct {\n\tmu sync.Mutex\n\tn  int\n}\n\nfunc read(c *Counter) int { return c.n }\n\nfunc main() {\n\tvar c Counter\n\t_ = read(&c)\n}\n"
          }
        ]
      },
      "enforcement": {
        "state": "advisory",
        "blocks": false
      },
      "benchmark": {
        "status": "unmeasured"
      }
    },
    {
      "id": "AP-GO-003",
      "revision": 1,
      "added_in": "1.0.0",
      "stack": "go",
      "framework": "none",
      "title": "HTTP response used before the error check",
      "description": "resp.Body is deferred closed (or used) before checking the error from the request.",
      "rationale": "When the request fails resp is nil, so the deferred Close panics.",
      "severity": "high",
      "confidence": "high",
      "detector": {
        "tool": "go-vet",
        "rule_id": "httpresponse",
        "custom": false,
        "mapping": {
          "status": "verified",
          "tool_version": "go version go1.26.10 linux/amd64",
          "verified_on": "2026-10-22",
          "verified_in": "local",
          "toolchain": "playbook-antipattern-toolchain@sha256:4ae0d1b7618684cf7d92adfdffe8afd2301e96edb25488ce90d67dee80558d4d"
        }
      },
      "remediation": "Check err first, then defer resp.Body.Close().",
      "references": [
        "https://pkg.go.dev/golang.org/x/tools/go/analysis/passes/httpresponse"
      ],
      "test_cases": {
        "positive": [
          {
            "file": "main.go",
            "code": "package main\n\nimport \"net/http\"\n\nfunc main() {\n\tresp, err := http.Get(\"https://example.com\")\n\tdefer resp.Body.Close()\n\tif err != nil {\n\t\treturn\n\t}\n}\n"
          }
        ],
        "negative": [
          {
            "file": "main.go",
            "code": "package main\n\nimport \"net/http\"\n\nfunc main() {\n\tresp, err := http.Get(\"https://example.com\")\n\tif err != nil {\n\t\treturn\n\t}\n\tdefer resp.Body.Close()\n}\n"
          }
        ]
      },
      "enforcement": {
        "state": "advisory",
        "blocks": false
      },
      "benchmark": {
        "status": "unmeasured"
      }
    },
    {
      "id": "AP-GO-004",
      "revision": 1,
      "added_in": "1.0.0",
      "stack": "go",
      "framework": "none",
      "title": "nil passed as a context",
      "description": "A function taking context.Context is called with nil.",
      "rationale": "Callees that read deadlines or values from the context panic; cancellation is lost.",
      "severity": "medium",
      "confidence": "high",
      "detector": {
        "tool": "staticcheck",
        "rule_id": "SA1012",
        "custom": false,
        "mapping": {
          "status": "verified",
          "tool_version": "staticcheck 2026.2.2 (0.8.2)",
          "verified_on": "2026-10-22",
          "verified_in": "local",
          "toolchain": "playbook-antipattern-toolchain@sha256:4ae0d1b7618684cf7d92adfdffe8afd2301e96edb25488ce90d67dee80558d4d"
        }
      },
      "remediation": "Pass context.TODO() or, better, the caller's context.",
      "references": [
        "https://staticcheck.dev/docs/checks/#SA1012"
      ],
      "test_cases": {
        "positive": [
          {
            "file": "main.go",
            "code": "package main\n\nimport \"context\"\n\nfunc work(ctx context.Context) {}\n\nfunc main() {\n\twork(nil)\n}\n"
          }
        ],
        "negative": [
          {
            "file": "main.go",
            "code": "package main\n\nimport \"context\"\n\nfunc work(ctx context.Context) {}\n\nfunc main() {\n\twork(context.TODO())\n}\n"
          }
        ]
      },
      "enforcement": {
        "state": "advisory",
        "blocks": false
      },
      "benchmark": {
        "status": "unmeasured"
      }
    },
    {
      "id": "AP-GO-005",
      "revision": 1,
      "added_in": "1.0.0",
      "stack": "go",
      "framework": "none",
      "title": "Error return value ignored",
      "description": "A call's error result is discarded without handling.",
      "rationale": "Failures continue silently and surface later, far from the cause.",
      "severity": "medium",
      "confidence": "medium",
      "detector": {
        "tool": "golangci-lint",
        "rule_id": "errcheck",
        "custom": false,
        "mapping": {
          "status": "mapped"
        }
      },
      "remediation": "Handle or explicitly return the error; discard only with a comment explaining why.",
      "references": [
        "https://github.com/kisielk/errcheck",
        "https://golangci-lint.run/usage/linters/#errcheck"
      ],
      "test_cases": {
        "positive": [
          {
            "file": "main.go",
            "code": "package main\n\nimport \"os\"\n\nfunc main() {\n\tos.Remove(\"/tmp/x\")\n}\n"
          }
        ],
        "negative": [
          {
            "file": "main.go",
            "code": "package main\n\nimport \"os\"\n\nfunc main() {\n\tif err := os.Remove(\"/tmp/x\"); err != nil {\n\t\tpanic(err)\n\t}\n}\n"
          }
        ]
      },
      "enforcement": {
        "state": "advisory",
        "blocks": false
      },
      "benchmark": {
        "status": "unmeasured"
      }
    },
    {
      "id": "AP-TS-001",
      "revision": 1,
      "added_in": "1.0.0",
      "stack": "typescript",
      "framework": "none",
      "title": "Floating promise",
      "description": "A promise is created and neither awaited, returned, nor handled.",
      "rationale": "Rejections are lost and ordering assumptions break; the bench's dropped-await defects are this.",
      "severity": "high",
      "confidence": "high",
      "detector": {
        "tool": "typescript-eslint",
        "rule_id": "@typescript-eslint/no-floating-promises",
        "custom": false,
        "mapping": {
          "status": "verified",
          "tool_version": "typescript-eslint@8.72.0 (eslint@9.39.5)",